local_filename,class,view_type,quality_note,commons_file_page_url,source_file,author,license,license_url,changes_made
destroying_angel_poor.jpg,deadly,poor_quality_field,"Lower-resolution field-style image with insect/clutter; useful as a less-clean real-world stress case.",https://commons.wikimedia.org/wiki/File:Going_for_a_bite_1117845500.jpg,"Going for a bite 1117845500.jpg",Miika Silfverberg,CC BY-SA 2.0,https://creativecommons.org/licenses/by-sa/2.0,Renamed only
death_cap_poor.jpg,deadly,cropped_low_resolution,"Low-resolution cropped Commons derivative; useful because the full mushroom context is reduced.",https://commons.wikimedia.org/wiki/File:Amanita_phalloides_1_cropped.jpg,"Amanita phalloides 1 cropped.jpg",Archenzo,CC BY-SA 3.0,https://creativecommons.org/licenses/by-sa/3.0,"Renamed only; the crop is from the Commons source file"
fly_agaric_poor.jpg,poisonous,blurry,"Commons page explicitly marks the image as blurry; useful for poor-photo safety testing.",https://commons.wikimedia.org/wiki/File:Fungus.JPG,Fungus.JPG,Off2riorob,CC BY-SA 3.0,https://creativecommons.org/licenses/by-sa/3.0,Renamed only
amanita_pantherina_poor.jpg,poisonous,field_observation,"Field-observation style Mushroom Observer image, less textbook-clean than Set A/B.",https://commons.wikimedia.org/wiki/File:Amanita_pantherina_1538476.jpg,"Amanita pantherina 1538476.jpg","Richard Daniel (RichardDaniel)",CC BY-SA 3.0,https://creativecommons.org/licenses/by-sa/3.0,Renamed only
chanterelle_poor.jpg,edible,low_resolution,"Small 640x480 Geograph image; useful as a low-detail edible comparison case.",https://commons.wikimedia.org/wiki/File:Cantharellus_cibarius_-_geograph.org.uk_-_561617.jpg,"Cantharellus cibarius - geograph.org.uk - 561617.jpg",David Baird,CC BY-SA 2.0,https://creativecommons.org/licenses/by-sa/2.0,Renamed only
